[
    {
        "title": "Graduate Student Researcher",
        "organization": "DavSec Lab @ UC Davis",
        "start": "April 2025",
        "end": "June 2026",
        "description": "Built an automated pipeline for C-to-Rust transpilation using LLMs, with 5 prompt variations, targeting secure systems migration.\nIdentified Halstead vocabulary as the strongest metric for predicting translation difficulty.\nValidated lightweight semantic augmentations (e.g., filename context) that improved functional accuracy by 5%.\nBenchmarked state-of-the-art LLMs across 746 C/C++ programs, achieving 70.2% functional accuracy with best prompt design.\nIntroduced a cross-layer analysis framework combining compiler-level metrics with hardware performance counters for C vs. Rust translations.\nExposed semantic and optimization gaps in LLM-translated and syntax-directed Rust translations.",
        "location": "Davis, CA",
        "image": "/images/ucdavis.png"
    },
    {
        "title": "Graduate Student Researcher",
        "organization": "UC Davis Computer Architecture Research Group",
        "start": "June 2023",
        "end": "June 2026",
        "description": "Co-developed SuperNOVA, a domain-specific superconducting graph accelerator that achieved an over 1800x reduction in power consumption and up to a 2157x improvement in energy efficiency over a CMOS baseline.\nImplemented custom full-system models in gem5 to simulate 100 GHz superconducting architectures, discovering that general-purpose performance is fundamentally bottlenecked by room-temperature main memory.\nMentored 5 undergraduate students in the Davis Computer Architecture Lab to prepare them for graduate research.\nUpstream contributor to gem5 (core simulator, gem5-resources, gem5 website, and the 2024 gem5 Bootcamp); authored official gem5 documentation for [gem5 Resources](https://www.gem5.org/documentation/general_docs/gem5_resources/), [Suites](https://www.gem5.org/documentation/gem5-stdlib/suites), [Local Resources Support](https://www.gem5.org/documentation/gem5-stdlib/local-resources-support), and [custom Standard Library boards](https://www.gem5.org/documentation/gem5-stdlib/develop-stdlib-board), and the RISC-V Getting Started Benchmark Suite.",
        "location": "Davis, CA",
        "image": "/images/darchr.png"
    },
    {
        "title": "Student Researcher",
        "organization": "Davis Excellent/Eclectic/Extreme Computational Analytics Lab",
        "start": "September 2022",
        "end": "Present",
        "description": "Co-authored paper on appending semantic information for better code summarization.\nCo-authored paper on calibration of LLM models, particularly involved in the bug repair section and tested models on Defects4J.",
        "location": "Davis, CA",
        "image": "/images/decallab.png"
    },
    {
        "title": "Undergraduate Researcher",
        "organization": "UC Davis Computer Architecture Research Group",
        "start": "June 2022",
        "end": "June 2023",
        "description": "Integrated the gem5 Standard Library components to create a pre-built board modeled after the HiFive Unmatched.\nValidating the statistics returned by the board on gem5 to those returned by perf on real-life hardware.\nCo-authored tutorials on perf compilation and documentation for the Standard Library.\nCo-authored poster on the comparison of gem5 and perf for HiFive Unmatched.",
        "location": "Davis, CA",
        "image": "/images/darchr.png"
    }
]