[
    {
        "title": "Teaching Assistant, ECS 132",
        "organization": "University of California, Davis",
        "start": "June 2023",
        "end": "December 2023",
        "description": "Assisted 180 students in understanding course material and assignments for ECS 132: Probability & Statistical Modeling for Computer Science.\nConducted weekly office hours and provided feedback on student assignments.",
        "location": "Davis, CA",
        "image": "/images/ucdavis.png"
    }
]